<?xml version="1.0" encoding="utf-8"?>
<!DOCTYPE toolbox SYSTEM "tool.dtd">
<toolbox>


<tool_item id="clear_data">
		<toolName>删除数据工具</toolName>
		<author>dbojue</author>
		<date>2010-02-25</date>
		<explain>用于删除系统内的数据。</explain>
		<contentIndex>clear_data</contentIndex>
		<contentAct>clear_data.php</contentAct>
		<programList>clear_data.php</programList>
	</tool_item></toolbox>
